{
  "$schema": "http://json-schema.org/draft-07/schema#",
  "$id": "urn:bunny:guide-release:1.0",
  "type": "object",
  "additionalProperties": false,
  "required": [
    "schemaVersion",
    "releaseId",
    "recordsVersion",
    "viewsVersion",
    "datasetId",
    "catalogId",
    "asOf",
    "generator",
    "builtAt",
    "artifacts"
  ],
  "properties": {
    "schemaVersion": {
      "const": "guide-release/1.0"
    },
    "releaseId": {
      "type": "string",
      "pattern": "^sha256:[0-9a-f]{64}$"
    },
    "recordsVersion": {
      "type": "string",
      "pattern": "^guide-records/[0-9]+\\.[0-9]+$"
    },
    "viewsVersion": {
      "type": "string",
      "pattern": "^guide-views/[0-9]+\\.[0-9]+$"
    },
    "datasetId": {
      "type": "string",
      "pattern": "^sha256:[0-9a-f]{64}$"
    },
    "catalogId": {
      "type": "string",
      "pattern": "^sha256:[0-9a-f]{64}$"
    },
    "asOf": {
      "type": "string",
      "pattern": "^\\d{4}-\\d{2}-\\d{2}T\\d{2}:\\d{2}:\\d{2}(?:\\.\\d+)?Z$"
    },
    "generator": {
      "type": "object",
      "additionalProperties": false,
      "required": [
        "repository",
        "revision"
      ],
      "properties": {
        "repository": {
          "type": "string",
          "pattern": "^[A-Za-z0-9_.-]+/[A-Za-z0-9_.-]+$"
        },
        "revision": {
          "type": "string",
          "pattern": "^[0-9a-f]{40}$"
        }
      }
    },
    "builtAt": {
      "type": "string",
      "pattern": "^\\d{4}-\\d{2}-\\d{2}T\\d{2}:\\d{2}:\\d{2}(?:\\.\\d+)?Z$"
    },
    "artifacts": {
      "type": "array",
      "minItems": 2,
      "items": {
        "type": "object",
        "additionalProperties": false,
        "required": [
          "path",
          "kind",
          "sha256"
        ],
        "properties": {
          "path": {
            "type": "string",
            "pattern": "^(?!/)(?!.*\\.\\.)[A-Za-z0-9._/-]+$",
            "maxLength": 200
          },
          "kind": {
            "enum": [
              "records",
              "catalog",
              "page",
              "asset"
            ]
          },
          "sha256": {
            "type": "string",
            "pattern": "^[0-9a-f]{64}$"
          }
        }
      }
    }
  }
}
