{
  "schemaVersion": "guide-release/1.0",
  "releaseId": "sha256:73f5ea763b0a1c1a4fbc47833532cb2e478637733579a029054bb00ca123b642",
  "recordsVersion": "guide-records/2.0",
  "viewsVersion": "guide-views/1.0",
  "datasetId": "sha256:3813cece05943267e2d66989634552547a9e97f575da2c9a66be28991b55c194",
  "catalogId": "sha256:b594947c7e91af036a7011b0238ccc670ea4796bcea81cd22ad672065a75cbe3",
  "asOf": "2026-10-02T04:33:27.660Z",
  "generator": {
    "repository": "jimmie-potts/agent-device-hub",
    "revision": "33f90d291a2122979739068fd14757b60efc88cc"
  },
  "builtAt": "2026-10-02T04:33:27.660Z",
  "artifacts": [
    {
      "path": "records.json",
      "kind": "records",
      "sha256": "b625eef12818cc5bcab603cf3aacbed1a5d54a149e3aa4c565937d5763e35c5a"
    },
    {
      "path": "catalog.json",
      "kind": "catalog",
      "sha256": "a64cad8032af44049d94a92c42e96d1cd06426b487802736fdbc01f308ecf57c"
    },
    {
      "path": "pages.json",
      "kind": "page",
      "sha256": "b8d9657ae8f2cc02f01e1425e98ecfbfcb93ef54056e8c0afa0dce799771f7ea"
    },
    {
      "path": "app.js",
      "kind": "asset",
      "sha256": "5b12e05fc35fac8f2dd4dd80a64556fef9d123bb7b6727b843a2c957123df6a6"
    },
    {
      "path": "style.css",
      "kind": "asset",
      "sha256": "23cefe3c49fba0d5f5fe1202bad81e5dc7867fbf1d9efad0b1c7c80e7fbdf742"
    }
  ]
}
