{
  "schemaVersion": "guide-release/1.0",
  "releaseId": "sha256:c7c8e1bba6925a4f57aaf06cdd4c43267f87ce9e4d1075c6a72db2c6f1c30d13",
  "recordsVersion": "guide-records/2.0",
  "viewsVersion": "guide-views/1.0",
  "datasetId": "sha256:3813cece05943267e2d66989634552547a9e97f575da2c9a66be28991b55c194",
  "catalogId": "sha256:b594947c7e91af036a7011b0238ccc670ea4796bcea81cd22ad672065a75cbe3",
  "asOf": "2026-10-02T04:33:27.660Z",
  "generator": {
    "repository": "jimmie-potts/agent-device-hub",
    "revision": "bbf6c27aa4e994917687de9283107221d5cbcc16"
  },
  "builtAt": "2026-10-02T04:33:27.660Z",
  "artifacts": [
    {
      "path": "records.json",
      "kind": "records",
      "sha256": "b625eef12818cc5bcab603cf3aacbed1a5d54a149e3aa4c565937d5763e35c5a"
    },
    {
      "path": "catalog.json",
      "kind": "catalog",
      "sha256": "a64cad8032af44049d94a92c42e96d1cd06426b487802736fdbc01f308ecf57c"
    },
    {
      "path": "pages.json",
      "kind": "page",
      "sha256": "94870717a07d131ea8fea501a8a81bbecf05d1423a4056e80bf8ca687d2d0b47"
    },
    {
      "path": "app.js",
      "kind": "asset",
      "sha256": "a620af38521352c0f5ffb5e91758ec283a631b7183f5b1a17284ac5cfa50ed3b"
    },
    {
      "path": "style.css",
      "kind": "asset",
      "sha256": "23cefe3c49fba0d5f5fe1202bad81e5dc7867fbf1d9efad0b1c7c80e7fbdf742"
    }
  ]
}
